{
  "task_id": "EXT-DEMO-001",
  "created_at": "2026-04-14T16:51:43Z",
  "from_external_app": "Claude Desktop",
  "requester": "external-demo",
  "title": "Demo delegated task",
  "objective": "Validate external delegation flow",
  "target_paths": ["docs/collab","tools/collab"],
  "acceptance_criteria": ["event logged","sqlite updated"],
  "priority": "normal",
  "urgency": "soon",
  "status": "NEW",
  "owner": "unassigned"
}
